{
  "paragraph_plans": [
    {
      "paragraph_id": "P001",
      "section_id": "S001",
      "paragraph_role": "context_setting",
      "topic_sentence_purpose": "Open with domain context and evidence boundary.",
      "main_claim_id": "MC001",
      "supporting_claim_ids": [],
      "linked_problem_id": "P001",
      "linked_contribution_id": "C1",
      "linked_evidence_ids": [],
      "linked_experiment_ids": [],
      "required_citation_ids": [
        "CR001"
      ],
      "required_result_placeholder_ids": [],
      "claim_safety_level": "needs_citation",
      "manuscript_claim_status": "citation_required",
      "unsafe_wording_to_avoid": [
        "first",
        "novel",
        "outperforms",
        "statistically significant"
      ],
      "safer_wording": "Use planned validation and requirement wording.",
      "reviewer_risk": "Reviewer may ask for evidence or clearer boundaries.",
      "revision_hooks": [
        "Add verified citation or real result evidence before strengthening this paragraph."
      ]
    },
    {
      "paragraph_id": "P002",
      "section_id": "S001",
      "paragraph_role": "gap_claim",
      "topic_sentence_purpose": "Establish specific gap without first/novel wording.",
      "main_claim_id": "MC002",
      "supporting_claim_ids": [
        "MC001"
      ],
      "linked_problem_id": "P001",
      "linked_contribution_id": "C1",
      "linked_evidence_ids": [],
      "linked_experiment_ids": [
        "EX001"
      ],
      "required_citation_ids": [
        "CR002"
      ],
      "required_result_placeholder_ids": [
        "RP001"
      ],
      "claim_safety_level": "needs_experiment_result",
      "manuscript_claim_status": "experiment_result_required",
      "unsafe_wording_to_avoid": [
        "first",
        "novel",
        "outperforms",
        "statistically significant"
      ],
      "safer_wording": "Use planned validation and requirement wording.",
      "reviewer_risk": "Reviewer may ask for evidence or clearer boundaries.",
      "revision_hooks": [
        "Add verified citation or real result evidence before strengthening this paragraph."
      ]
    },
    {
      "paragraph_id": "P003",
      "section_id": "S001",
      "paragraph_role": "contribution_claim",
      "topic_sentence_purpose": "Preview contributions and validation plan only.",
      "main_claim_id": "MC003",
      "supporting_claim_ids": [
        "MC002"
      ],
      "linked_problem_id": "P001",
      "linked_contribution_id": "C2",
      "linked_evidence_ids": [],
      "linked_experiment_ids": [
        "EX001"
      ],
      "required_citation_ids": [],
      "required_result_placeholder_ids": [
        "RP002"
      ],
      "claim_safety_level": "needs_experiment_result",
      "manuscript_claim_status": "experiment_result_required",
      "unsafe_wording_to_avoid": [
        "first",
        "novel",
        "outperforms",
        "statistically significant"
      ],
      "safer_wording": "Use planned validation and requirement wording.",
      "reviewer_risk": "Reviewer may ask for evidence or clearer boundaries.",
      "revision_hooks": [
        "Add verified citation or real result evidence before strengthening this paragraph."
      ]
    },
    {
      "paragraph_id": "P004",
      "section_id": "S002",
      "paragraph_role": "known_stream_summary",
      "topic_sentence_purpose": "Organize streams and relation to selected problem.",
      "main_claim_id": "MC004",
      "supporting_claim_ids": [],
      "linked_problem_id": "P001",
      "linked_contribution_id": "C3",
      "linked_evidence_ids": [],
      "linked_experiment_ids": [],
      "required_citation_ids": [
        "CR003",
        "CR004"
      ],
      "required_result_placeholder_ids": [],
      "claim_safety_level": "needs_citation",
      "manuscript_claim_status": "citation_required",
      "unsafe_wording_to_avoid": [
        "first",
        "novel",
        "outperforms",
        "statistically significant"
      ],
      "safer_wording": "Use planned validation and requirement wording.",
      "reviewer_risk": "Reviewer may ask for evidence or clearer boundaries.",
      "revision_hooks": [
        "Add verified citation or real result evidence before strengthening this paragraph."
      ]
    },
    {
      "paragraph_id": "P005",
      "section_id": "S003",
      "paragraph_role": "problem_formulation",
      "topic_sentence_purpose": "Define coupled problem properties.",
      "main_claim_id": "MC005",
      "supporting_claim_ids": [],
      "linked_problem_id": "P001",
      "linked_contribution_id": "C1",
      "linked_evidence_ids": [],
      "linked_experiment_ids": [],
      "required_citation_ids": [
        "CR005"
      ],
      "required_result_placeholder_ids": [],
      "claim_safety_level": "corpus_scoped_only",
      "manuscript_claim_status": "planned",
      "unsafe_wording_to_avoid": [
        "first",
        "novel",
        "outperforms",
        "statistically significant"
      ],
      "safer_wording": "Use planned validation and requirement wording.",
      "reviewer_risk": "Reviewer may ask for evidence or clearer boundaries.",
      "revision_hooks": [
        "Add verified citation or real result evidence before strengthening this paragraph."
      ]
    },
    {
      "paragraph_id": "P006",
      "section_id": "S004",
      "paragraph_role": "design_rationale",
      "topic_sentence_purpose": "Map mechanism to problem property and ablation.",
      "main_claim_id": "MC006",
      "supporting_claim_ids": [],
      "linked_problem_id": "P001",
      "linked_contribution_id": "C2",
      "linked_evidence_ids": [],
      "linked_experiment_ids": [
        "EX001"
      ],
      "required_citation_ids": [],
      "required_result_placeholder_ids": [
        "RP002"
      ],
      "claim_safety_level": "needs_experiment_result",
      "manuscript_claim_status": "experiment_result_required",
      "unsafe_wording_to_avoid": [
        "first",
        "novel",
        "outperforms",
        "statistically significant"
      ],
      "safer_wording": "Use planned validation and requirement wording.",
      "reviewer_risk": "Reviewer may ask for evidence or clearer boundaries.",
      "revision_hooks": [
        "Add verified citation or real result evidence before strengthening this paragraph."
      ]
    },
    {
      "paragraph_id": "P007",
      "section_id": "S005",
      "paragraph_role": "validation_setup",
      "topic_sentence_purpose": "Describe validation setup, not results.",
      "main_claim_id": "MC007",
      "supporting_claim_ids": [],
      "linked_problem_id": "P001",
      "linked_contribution_id": "C2",
      "linked_evidence_ids": [],
      "linked_experiment_ids": [
        "EX001"
      ],
      "required_citation_ids": [
        "CR006"
      ],
      "required_result_placeholder_ids": [
        "RP001",
        "RP002"
      ],
      "claim_safety_level": "needs_experiment_result",
      "manuscript_claim_status": "experiment_result_required",
      "unsafe_wording_to_avoid": [
        "first",
        "novel",
        "outperforms",
        "statistically significant"
      ],
      "safer_wording": "Use planned validation and requirement wording.",
      "reviewer_risk": "Reviewer may ask for evidence or clearer boundaries.",
      "revision_hooks": [
        "Add verified citation or real result evidence before strengthening this paragraph."
      ]
    },
    {
      "paragraph_id": "P008",
      "section_id": "S006",
      "paragraph_role": "evidence_interpretation",
      "topic_sentence_purpose": "Reserve result interpretation until evidence exists.",
      "main_claim_id": "MC008",
      "supporting_claim_ids": [],
      "linked_problem_id": "P001",
      "linked_contribution_id": "C3",
      "linked_evidence_ids": [],
      "linked_experiment_ids": [
        "EX001"
      ],
      "required_citation_ids": [],
      "required_result_placeholder_ids": [
        "RP003"
      ],
      "claim_safety_level": "needs_experiment_result",
      "manuscript_claim_status": "experiment_result_required",
      "unsafe_wording_to_avoid": [
        "first",
        "novel",
        "outperforms",
        "statistically significant"
      ],
      "safer_wording": "Use planned validation and requirement wording.",
      "reviewer_risk": "Reviewer may ask for evidence or clearer boundaries.",
      "revision_hooks": [
        "Add verified citation or real result evidence before strengthening this paragraph."
      ]
    },
    {
      "paragraph_id": "P009",
      "section_id": "S007",
      "paragraph_role": "limitation_statement",
      "topic_sentence_purpose": "State limitations and threats.",
      "main_claim_id": "MC009",
      "supporting_claim_ids": [],
      "linked_problem_id": "P001",
      "linked_contribution_id": "C3",
      "linked_evidence_ids": [],
      "linked_experiment_ids": [
        "EX001"
      ],
      "required_citation_ids": [
        "CR007"
      ],
      "required_result_placeholder_ids": [
        "RP004"
      ],
      "claim_safety_level": "safe",
      "manuscript_claim_status": "planned",
      "unsafe_wording_to_avoid": [
        "first",
        "novel",
        "outperforms",
        "statistically significant"
      ],
      "safer_wording": "Use planned validation and requirement wording.",
      "reviewer_risk": "Reviewer may ask for evidence or clearer boundaries.",
      "revision_hooks": [
        "Add verified citation or real result evidence before strengthening this paragraph."
      ]
    },
    {
      "paragraph_id": "P010",
      "section_id": "S008",
      "paragraph_role": "transition",
      "topic_sentence_purpose": "Conclude without new claims.",
      "main_claim_id": "MC010",
      "supporting_claim_ids": [],
      "linked_problem_id": "P001",
      "linked_contribution_id": "C3",
      "linked_evidence_ids": [],
      "linked_experiment_ids": [],
      "required_citation_ids": [],